{
  "schema_id": "wellmanifest.pcb/style/v1",
  "id": "wellmanifest/pcb",
  "version": "1.1.0",
  "profile": "panel9",
  "title": "Lokalne rozszerzenie standardu wellmanifest/pcb dla projektu panel9",
  "routing": {
    "via_cost": 320,
    "net_order": ["GP4", "GP1", "GP14", "GP8", "ENC_B", "GND"]
  },
  "rules": {
    "RULE_LAYER_STACKUP": {
      "layers": ["F.Cu", "B.Cu"],
      "count": 2,
      "description": "Dwie warstwy: elementy na B.Cu, przyciski na F.Cu. Trzecia warstwa zmienia wycenę."
    },
    "RULE_TRACK_WIDTH_MIN": {
      "min_mm": 0.35,
      "description": "Twarde minimum procesu to 0.35 mm; docelowe szerokości projektu rozstrzyga reguła klas sieci."
    },
    "RULE_TRACK_WIDTH_BY_NET": {
      "severity": "blocking",
      "classes": [
        {"name": "power", "net_pattern": "^(GND|\\+[0-9]+V[0-9]*)$", "min_mm": 0.6},
        {"name": "signal", "net_pattern": ".*", "min_mm": 0.5}
      ],
      "description": "Zasilanie i GND wymagają 0.6 mm, pozostałe sygnały co najmniej 0.5 mm."
    },
    "RULE_TRACK_WIDTH_MAX": {
      "max_mm": 0.6,
      "description": "Najszersza użyta ścieżka to magistrala GND 0.6 mm."
    },
    "RULE_COORDINATE_GRID": {
      "min_mm": 0.005,
      "description": "Raster minimalny projektu — nic drobniejszego nie ma prawa się pojawić."
    },
    "RULE_TRACK_GRID": {
      "severity": "advisory",
      "grid_mm": 0.05,
      "description": "Raster trasowania. Dziś 38 końców ścieżek jest poza nim — dług do uporządkowania."
    },
    "RULE_FOOTPRINT_GRID": {
      "severity": "advisory",
      "grid_mm": 0.5,
      "rotations_deg": [0, 90, 180, 270],
      "description": "Raster montażowy. U1, J1 i kondensatory stoją poza nim — dług do uporządkowania."
    },
    "RULE_TRACK_ANGLE": {
      "severity": "blocking",
      "angles_deg": [0, 90],
      "description": "Ścieżki biegną wyłącznie poziomo lub pionowo; skosy i skróty są błędem."
    },
    "RULE_ZONE_LAYER_ALLOWLIST": {
      "layers": [],
      "description": "Panel9 nie używa stref: wypełnienie B.Cu zostało usunięte świadomie (commit 4d04d6f)."
    },
    "RULE_NO_COPPER_UNDER_PART": {
      "shielded_pattern": "SW|TACT|BUTTON|RJ45|SHIELD|USB|JACK",
      "description": "Przyciski tact mają metalową kopułkę dociskaną do laminatu."
    },
    "RULE_COMPONENT_EDGE_CLEARANCE": {
      "enabled": true,
      "severity": "blocking",
      "min_mm": 2.54,
      "exceptions": [
        {
          "reference": "U1",
          "reason": "moduł RP2040-Zero wystawia USB na lewą krawędź"
        },
        {
          "reference": "J1",
          "reason": "RJ45 jest złączem edge-mount kontrolowanym przez RULE_EDGE_MOUNT_CONNECTOR_ALIGNMENT"
        }
      ],
      "description": "Zwykłe elementy panel9 zachowują 2,54 mm od Edge.Cuts; U1 i J1 mają funkcjonalny kontakt z krawędzią i osobne kontrakty mechaniczne."
    },
    "RULE_FOOTPRINT_INTERNAL_CONNECTIVITY": {
      "enabled": true,
      "severity": "blocking",
      "components": [
        {
          "part_pattern": "(?:^|:)SW_TACT_5\\.2x5\\.2$",
          "terminal_groups": [["1", "3"], ["2", "4"]],
          "require_distinct_groups": true
        }
      ],
      "description": "Rzeczywisty TACT panel9 ma poziome pary zwarte wewnętrznie: pady 1+3 oraz 2+4; pionowe przypisanie zwierałoby GPIO z GND bez naciskania."
    },
    "RULE_CONNECTOR_COURTYARD_MARGIN": {
      "margin_mm": 2.54,
      "description": "Przy RJ45 obce korytarze miedzi pozostają co najmniej jeden raster 2,54 mm poza obrysem złącza."
    },
    "RULE_CONNECTOR_EDGE_CLEARANCE": {
      "min_mm": 2.54,
      "edge_mount_references": ["J1"],
      "description": "Zwykłe złącza pozostają 2,54 mm wewnątrz Edge.Cuts; J1 jest jawnie kontrolowany osobną regułą edge_mount."
    },
    "RULE_CONNECTOR_PAD_EDGE_CLEARANCE": {
      "min_mm": 2.54,
      "edge_mount_references": ["J1"],
      "description": "Pady zwykłych złączy pozostają 2,54 mm od Edge.Cuts; pady J1 sprawdza osobny kontrakt edge_mount."
    },
    "RULE_TRACK_EDGE_CLEARANCE": {
      "min_mm": 2.54,
      "description": "Ścieżki pozostają co najmniej 2,54 mm od Edge.Cuts."
    },
    "RULE_VIA_EDGE_CLEARANCE": {
      "min_mm": 2.54,
      "description": "Odległość jest liczona od zewnętrznej krawędzi pierścienia via, nie od środka."
    },
    "RULE_EDGE_MOUNT_CONNECTOR_ALIGNMENT": {
      "enabled": true,
      "severity": "blocking",
      "connectors": [
        {
          "reference": "J1",
          "edge": "right",
          "max_body_gap_mm": 0.2,
          "min_copper_edge_mm": 1.5
        }
      ],
      "description": "RJ45 J1 jest złączem krawędziowym: obudowa dochodzi do prawej krawędzi, a najbliższy pad ekranu zachowuje co najmniej 1,5 mm miedzi do Edge.Cuts."
    },
    "RULE_VIA_IN_PAD": {
      "severity": "blocking",
      "include_annulus_overlap": false,
      "exceptions": [],
      "description": "Panel9 nie deklaruje procesu filled-and-capped, dlatego środek via w padzie SMD jest blokadą. Nachodzenie samego tentowanego pierścienia można włączyć osobno jako audyt doradczy."
    },
    "RULE_PIN_WIRE_GAP": {
      "max_gap_mm": 1.0,
      "description": "C3 stał tak z luką 0,63 mm i wyglądał na podłączony."
    },
    "RULE_SCH_PCB_NET_PARITY": {
      "severity": "blocking",
      "description": "Schemat i PCB muszą mówić to samo o każdym pinie."
    }
  },
  "repairs": {
    "zone_fill_clears": ["unconnected_items", "via_dangling"]
  }
}
